ID,Campaign ID,Row_Counter,Name,Target,Status,Developer/Reseacher,Format,Derivation,Discovery platform,Country,Anticipated Next Steps Timing,Descriptions,References,last updated,Name of person who updated the record
1,1,1,REGN-COV2,S protein,Preclinical,Regeneron,mAb cocktail,Humanized mouse; Human,Humanized mouse; single B cell cloning,USA,"Begin human studies in June, 2020",Regeneron have produced hundreds of virus-neutralizing antibodies in our genetically-engineered mice and isolated similarly-performing antibodies from human COVID-19 survivors.,1. https://newsroom.regeneron.com/index.php/news-releases/news-release-details/regeneron-announces-important-advances-novel-covid-19-antibody 2. https://www.biopharma-reporter.com/Article/2020/05/11/Regeneron-devotes-facility-to-COVID-treatment,05/17/2020,B.L
2,2,1,VIR-7831,S protein,Preclinical,Vir biotechnology/WuXi biologicals/Biogen/GSK/Xencor/Samsung Biologics,mAb,Human,single B cell cloning,USA/China/UK/South Korea,"Phase 2 trial in three to five months (July to September, 2020)","VIR-7831 and VIR-7832 are monoclonal antibodies that have demonstrated the ability to neutralize SARS-CoV-2 live virus. The antibody binds to an epitope on SARS-CoV-2 that is shared with SARS-CoV-1 (also known as SARS), indicating that the epitope is highly conserved.VIR-7831 and VIR-7832 are based on the S309 antibody.",1. https://investors.vir.bio/news-releases/news-release-details/vir-biotechnology-proceeding-two-clinical-development-candidates 2. https://investors.vir.bio/news-releases/news-release-details/identification-and-characterization-potential-therapeutic-covid 3. https://www.nature.com/articles/s41586-020-2349-y_reference.pdf,05/18/2020,B.L
3,2,1,VIR-7832,S protein,Preclinical,Vir biotechnology/WuXi biologicals/Biogen/GSK/Xencor/Samsung Biologics,mAb,Human,single B cell cloning,USA/China/UK/South Korea,"Phase 2 trial in three to five months (July to September, 2020)","VIR-7831 and VIR-7832 are monoclonal antibodies that have demonstrated the ability to neutralize SARS-CoV-2 live virus. The antibody binds to an epitope on SARS-CoV-2 that is shared with SARS-CoV-1 (also known as SARS), indicating that the epitope is highly conserved.",1. https://investors.vir.bio/news-releases/news-release-details/vir-biotechnology-proceeding-two-clinical-development-candidates 2. https://investors.vir.bio/news-releases/news-release-details/identification-and-characterization-potential-therapeutic-covid 3. https://www.nature.com/articles/s41586-020-2349-y_reference.pdf,05/17/2020,B.L
4,3,1,JS016,S protein,Preclinical,"Junshi Biosciences/Institute of Microbiology, Chinese Academy of Sciences/Eli Lilly",mAb,Human,single B cell cloning,China/USA,clinical studies in the U.S. in the second quarter of 2020,JS016 is a recombinant fully human monoclonal neutralizing antibody that is specific to the SARS-CoV-2 surface spike protein receptor binding domain and can effectively block the binding of viruses to host cell surface receptor ACE2.,1. http://junshipharma.com/en/News.html 2. https://www.fiercepharma.com/pharma/coronavirus-tracker-hydroxychloroquine-fails-va-study-fda-approves-at-home-sample-collection,05/17/2020,B.L
5,4,1,,S protein,Preclinical,Celltrion/Amgen,mAb or mAb cocktail,Human,,South Korea/USA,"starting human trial in July, 2020","Celltrion has identified the library of antibodies sourced from the blood of recovered patients in Korea, which are thought to be involved in neutralising the virus and may contribute to recovery from COVID-19.",1. https://www.celltrionhealthcare.com/en-us/board/newsdetail?modify_key=174&pagenumber=1&keyword=&keyword_type= 2. https://www.pharmashots.com/30833/celltrion-anticipates-the-initiation-of-its-first-in-human-clinicaltargeting-covid-19-in-july/ 3. https://www.businesswire.com/news/home/20200403005084/en/Celltrion’s-COVID-19-Antiviral-Treatment-Enters-Phase-Development,05/17/2020,B.L
6,5,1,,S protein,Preclinical,AbCellera/Eli Lilly,mAb,Human,single B cell cloning,Canada/USA,clinical trials to begin in July 2020 or earlier,AbCellera has identified over 500 unique fully human antibody sequences from one of the first U.S. patients who recovered from COVID-19,1. https://investor.lilly.com/news-releases/news-release-details/abcellera-and-lilly-co-develop-antibody-therapies-treatment 2. https://www.reuters.com/article/us-health-coronavirus-canada-abcellera/canada-giving-abcellera-biologics-c176-million-for-coronavirus-research-idUSKBN22F0R8,05/17/2020,B.L
7,6,1,,S protein,Preclinical,Tsinghua University/Brii Bio,mAb,Human,single B cell cloning,China/USA,starting human trial in the third quarter of 2020,"Researchers in the laboratories of Professor Linqi Zhang at Tsinghua University and Professor Zheng Zhang at 3rd People’s Hospital of Shenzhen have identified multiple diverse and potent neutralizing monoclonal antibodies with therapeutic potential against SARS CoV-2 that have been characterized from patients in China who have recovered from COVID-19; March 31, 2020: Tsinghua University, 3rd People’s Hospital of Shenzhen and Brii Biosciences (“Brii Bio”) announced a partnership and license agreement to discover, develop, manufacture and commercialize fully human neutralizing monoclonal antibodies to address the global pandemic of COVID-19. Tsinghua, 3rd People’s Hospital of Shenzhen and Brii Bio seek to achieve an accelerated timeline of six months from the selection of a lead development candidate to the first-in-human clinical trials, with the potential for additional timeline acceleration. Tsinghua and collaborators at 3rd People’s Hospital of Shenzhen will provide capabilities and researchers to ensure all necessary testing, screening, virologic, biochemical and cell culture characterizations. Brii Bio will provide development expertise, antibody optimization, intellectual protection, project management, CDMO management, and clinical and regulatory oversight.",1. https://www.briibio.com/news/45.html; Ju et al. Potent human neutralizing antibodies elicited by SARS-CoV-2 infection. https://www.biorxiv.org/content/10.1101/2020.03.21.990770v1.full.pdf,05/17/2020,B.L
8,7,1,,S protein,Preclinical,Shanghai henlius biotech/Sanyou Biopharmaceuticals/Shanghai ZJ Bio-Tech,mAb,Human,Phage display,China,,,1. https://www.reuters.com/article/brief-shanghai-henlius-biotech-says-ente/brief-shanghai-henlius-biotech-says-entered-cooperation-agreement-with-sanyou-biopharmaceuticals-shanghai-zj-bio-tech-idUSFWN2CO0S5,05/17/2020,B.L
8,8,1,,S protein,Preclinical,YUMAB /CORAT consortium,mAb,Human,,Germany,start clinical studies in humans in the 2nd half of 2020,YUMAB built antibody libraries from recovered COVID-19 donors for identification of additional therapeutic candidates.,1. https://www.biospace.com/article/releases/yumab-identifies-promising-candidate-for-covid-19-antibody-therapy/,05/17/2020,B.L
9,9,1,,S protein,Preclinical,Vanderbilt University Medical Center/AstraZeneca,mAb,Human,single B cell cloning,USA/UK/Sweden,,,1. https://news.vumc.org/2020/03/23/researchers-developing-potential-coronavirus-antibody-therapies/,05/17/2020,B.L
14,10,1,B38,S protein,Preclinical,"Institute of Microbiology, Chinese Academy of Sciences/Shenzhen Third People’s Hospital/",mAb,Human,single B cell cloning,China,,"B38 and H4 block the binding between RBD and vial cellular receptor ACE2. Further competition assay indicates that B38 and H4 recognize different epitopes on the RBD, which is ideal for a virus-targeting mAb-pair to avoid immune escape in the future clinical applications. Moreover, therapeutic study on the mouse model validated that these two antibodies can reduce virus titers in the infected mouse lungs. Structure of RBD-B38 complex revealed that most residues on the epitope are overlapped with the RBD-ACE2 binding interface, which explained the blocking efficacy and neutralizing capacity.",1. https://www.medrxiv.org/content/10.1101/2020.05.01.20077743,05/17/2020,B.L
15,10,1,H4,S protein,Preclinical,"Institute of Microbiology, Chinese Academy of Sciences/Shenzhen Third People’s Hospital/",mAb,Human,single B cell cloning,China,,"B38 and H4 block the binding between RBD and vial cellular receptor ACE2. Further competition assay indicates that B38 and H4 recognize different epitopes on the RBD, which is ideal for a virus-targeting mAb-pair to avoid immune escape in the future clinical applications. Moreover, therapeutic study on the mouse model validated that these two antibodies can reduce virus titers in the infected mouse lungs. Structure of RBD-B38 complex revealed that most residues on the epitope are overlapped with the RBD-ACE2 binding interface, which explained the blocking efficacy and neutralizing capacity.",1. https://www.medrxiv.org/content/10.1101/2020.05.01.20077743,05/17/2020,B.L
16,11,1,,S protein,Preclinical,Peking university/Sino Biological,mAb,Human,single B cell cloning,China,,,1. https://biopic.pku.edu.cn/zxdt/502171.htm 2. http://newsen.pku.edu.cn/news_events/news/research/9779.htm,05/18/2020,B.L
17,12,1,,S protein,Preclinical,Jemincare,mAb,,,China,,,,05/17/2020,B.L
18,13,1,STI-1499,S protein,Preclinical,Sorrento/Mount Sinai Health System,mAb,,,USA,,"STI-1499 completely neutralized the virus infectivity at a very low antibody dose, making it a prime candidate for further testing and development. Sorrento Therapeutics and Mount Sinai Health System in New York City have joined forces to develop an antibody cocktail they hope will shield against Covid-19 infection for up to two months.",1. https://investors.sorrentotherapeutics.com/news-releases/news-release-details/sti-1499-potent-anti-sars-cov-2-antibody-demonstrates-ability; 2. https://www.cnbc.com/2020/05/08/sorrento-therapeutics-mount-sinai-develop-covid-19-antibody-shield.html,05/17/2020,B.L
19,14,1,4A8,S protein,Preclinical,"Academy of Military Medical Sciences/Westlake University/Tsinghua-Peking Joint Center for
 Life Sciences",mAb,Human,single B cell cloning,China,,"An mAb targeting the N-terminal domain (NTD) of the SARS-CoV-2 S protein, named 4A8, exhibits high neutralization potency against both authentic and pseudotyped SARS-CoV-2, although it does not block the interaction between angiotensin-converting enzyme 2 (ACE2) receptor and S protein. The cryo-EM structure of the SARS-CoV-2 S protein in complex with 4A8 has been determined to an overall resolution of 3.1 Angstrom and local resolution of 3.4 Angstrom for the 4A8-NTD interface, revealing detailed interactions between the NTD and 4A8.",1.https://www.biorxiv.org/content/10.1101/2020.05.08.083964v1,05/17/2020,X.X
20,15,1,47D11,S protein,Preclinical,Utrecht University/ Erasmus MC/ Harbor BioMed/Mount Sinai Health System,mAb,Humanized mouse,Humanized mouse,Netherlands/China/USA,,"47D11 was discovered from the H2L2 Harbour Mice® platform. 47D11 binds a conserved epitope on the spike receptor binding domain and cross-neutralizes SARS-CoV and SARS-CoV-2.Data show that 47D11 neutralizes SARS-CoV and SARS-CoV-2 through a yet unknown mechanism that is different from receptor binding interference. Alternative mechanisms of coronavirus neutralization by receptor binding domain-targeting antibodies have been reported including spike inactivation through antibody-induced destabilization of its prefusion structure, which may also apply for 47D11. Harbour BioMed has partnered with academic medical system Mount Sinai Health to develop biotherapies for Covid-19 and cancer. The partners entered into a multi-year, multifaceted agreement, which will focus on fully human antibodies.",1. https://www.nature.com/articles/s41467-020-16256-y; 2. https://www.immunology.ox.ac.uk/covid-19/literature-digest-old/a-human-monoclonal-antibody-blocking-sars-cov-2-infection; 3. https://www.pharmaceutical-technology.com/news/harbour-biomed-sinai-covid-19-drugs/,05/17/2020,X.X
21,16,1,VHH-72,S protein,Preclinical,The University of Texas at Austin/Ghent University,VHH,llama,llama immunization,USA/Belgium,,"Targets RBD domain; epitope does not directly overlap with ACE2 binding site; cross-neutralize SARS-CoV; does not neutralize SARS-CoV-2 by monovalent VHH; March 16, 2020 press release.",https://www.sciencedirect.com/science/article/pii/S0092867420304943,05/17/2020,X.X
22,17,1,,S protein,Preclinical,Fudan University,VHH,,Phage display,China,,Epitope binning showed the antibodies bind 5 antigenic sites on RBD (group A-E); the most potent antibodies n3130 and n3088 are within group D,ttps://www.biorxiv.org/content/10.1101/2020.03.30.015990v1,05/17/2020,X.X
23,18,1,311mab-31B5,S protein,Preclinical,Third Military Medical University/Chongqing Public Health Medical Center/Chinese Academy of Medical Sciences and Peking Union Medical College,mAb,Human,single B cell cloning,China,,"311mab-31B5 and 311mab-32D4 effectively neutralized pseudovirus entry to host cells ectopically expressing hACE2 (IC50 = 0.0338, and 0.0698 μg/ml, respectively)",https://www.nature.com/articles/s41423-020-0426-7,05/17/2020,X.X
24,18,1,311mab-32D4,S protein,Preclinical,Third Military Medical University/Chongqing Public Health Medical Center/Chinese Academy of Medical Sciences and Peking Union Medical College,mAb,Human,single B cell cloning,China,,"311mab-31B5 and 311mab-32D4 effectively neutralized pseudovirus entry to host cells ectopically expressing hACE2 (IC50 = 0.0338, and 0.0698 μg/ml, respectively)",https://www.nature.com/articles/s41423-020-0426-7,05/17/2020,X.X
25,19,1,1E2,S protein,Preclinical,Chinese Academy of Medical Sciences and Peking Union Medical College,mAb,Human,Phage display,China,,"All five antibodies showed neutralization efficiency IC50 at approximately 0.2-0.6 µg/mL; 1E2, 3F11 and 4D8 completely prevent binding of SARS-CoV-2 RBD to ACE2, sdAbs 2F2 and 5F8 could partially compete the RBD/receptor; several Fc-fused sdAbs demonstrated potency with IC80 at sub-nanomolar level",https://www.biorxiv.org/content/10.1101/2020.04.14.042010v1,05/17/2020,X.X
26,19,1,2F2,S protein,Preclinical,Chinese Academy of Medical Sciences and Peking Union Medical College,mAb,Human,Phage display,China,,"All five antibodies showed neutralization efficiency IC50 at approximately 0.2-0.6 µg/mL; 1E2, 3F11 and 4D8 completely prevent binding of SARS-CoV-2 RBD to ACE2, sdAbs 2F2 and 5F8 could partially compete the RBD/receptor; several Fc-fused sdAbs demonstrated potency with IC80 at sub-nanomolar level",https://www.biorxiv.org/content/10.1101/2020.04.14.042010v1,05/17/2020,X.X
27,19,1,3F11,S protein,Preclinical,Chinese Academy of Medical Sciences and Peking Union Medical College,mAb,Human,Phage display,China,,"All five antibodies showed neutralization efficiency IC50 at approximately 0.2-0.6 µg/mL; 1E2, 3F11 and 4D8 completely prevent binding of SARS-CoV-2 RBD to ACE2, sdAbs 2F2 and 5F8 could partially compete the RBD/receptor; several Fc-fused sdAbs demonstrated potency with IC80 at sub-nanomolar level",https://www.biorxiv.org/content/10.1101/2020.04.14.042010v1,05/17/2020,X.X
28,19,1,4D8,S protein,Preclinical,Chinese Academy of Medical Sciences and Peking Union Medical College,mAb,Human,Phage display,China,,"All five antibodies showed neutralization efficiency IC50 at approximately 0.2-0.6 µg/mL; 1E2, 3F11 and 4D8 completely prevent binding of SARS-CoV-2 RBD to ACE2, sdAbs 2F2 and 5F8 could partially compete the RBD/receptor; several Fc-fused sdAbs demonstrated potency with IC80 at sub-nanomolar level",https://www.biorxiv.org/content/10.1101/2020.04.14.042010v1,05/17/2020,X.X
29,19,1,5F8,S protein,Preclinical,Chinese Academy of Medical Sciences and Peking Union Medical College,mAb,Human,Phage display,China,,"All five antibodies showed neutralization efficiency IC50 at approximately 0.2-0.6 µg/mL; 1E2, 3F11 and 4D8 completely prevent binding of SARS-CoV-2 RBD to ACE2, sdAbs 2F2 and 5F8 could partially compete the RBD/receptor; several Fc-fused sdAbs demonstrated potency with IC80 at sub-nanomolar level",https://www.biorxiv.org/content/10.1101/2020.04.14.042010v1,05/17/2020,X.X
30,20,1,Anti-SARS mAb,S protein,Preclinical,Massachusetts Consortium on Pathogen Readiness (MassCPR),mAb,,,USA,,"Working group on therapeutics includes Jonathan Abraham, M.D., Ph.D., Mark Namchuk, Ph.D., and Wayne Marasco, MD PhD","1,https://masscpr.hms.harvard.edu/",5/18/2020,L.Y
31,21,1,Anti-SARS-CoV-2 Ab,S protein,Preclinical,"AstraZeneca, with partners Chinese Academy of Sciences, Vanderbilt University Medical Center, United States Army Medical Research Institute of Infectious Diseases (USAMRIID) and the University of Maryland School of Medicine",,,,USA/China,Summer 2020,"AstraZeneca scientists are exploring three potential sources for antibodies against the SARS CoV-2 virus – patients who have recovered from COVID-19, immunised humanised mice and laboratory techniques such as phage display; April 8, 2020: Under a recently signed agreement, genetic sequences for antibodies discovered in the Vanderbilt Vaccine Center (VVC) will be provided to AstraZeneca for identification of the most promising candidates for clinical assessment and future clinical use. The agreement with AstraZeneca allows VVC to continue working with other partners to develop antibodies for diagnostic and therapeutic applications.
  The spike protein on the SARS-CoV-2 virus is the primary target being explored for potential COVID-19 monoclonal antibodies. The aim is that by targeting the spike protein, the antibody will be able to neutralise the SARS-CoV-2 virus and affect its capacity to infect healthy cells. 
  AstraZeneca is harnessing its proprietary immune replica technology, developed as part of the abovementioned agreement with DARPA, which can capture and screen antibodies from millions of primary B cells. The company is also utilising hybridoma technology, which is a method for producing large numbers of monoclonal antibodies through a culture of hybrid cells that results from the fusion of B cells and immortal myeloma cells.
  Once identified, the monoclonal antibodies are screened against their ability to bind to the spike protein before further developability tests are carried out. AstraZeneca is aiming for clinical evaluation in the next 3 to 5 months. In addition to internal research and development, AstraZeneca is collaborating with government and academic experts to evaluate additional promising candidates for future clinical use. The Chinese Academy of Sciences (China) and Vanderbilt University Medical Center (US) are providing AstraZeneca with genetic sequences for antibodies they have discovered against SARS2-CoV-2 for further in silico and in vitro assessment.
  Via collaborations with the United States Army Medical Research Institute of Infectious Diseases (USAMRIID) and the University of Maryland School of Medicine, promising antibodies from AstraZeneca, discovered through its internal research efforts and collaborations, will undergo preclinical safety and efficacy assessment in the organisations’ biosafety level 3 (BSL3) laboratories.",,5/18/2020,L.Y
32,22,1,Anti-SARS-CoV-2,S protein,Preclinical,"Vanderbilt University Medical Center/academic, governmental and corporate partners",,,,USA,Summer 2020,"March 23, 2020. “Our goal is to prepare antibodies for human clinical trials by this summer,” said James Crowe, MD, director of the Vanderbilt Vaccine Center (VVC). “We have ultra-rapid antibody discovery technologies and already have discovered SARS-CoV-2 antibodies,” Crowe said. “Our partners have the manufacturing and product development expertise to turn these antibodies into effective biological drugs very quickly.”","1, https://clarksvillenow.com/local/vanderbilt-researchers-developing-potential-coronavirus-antibodies-therapy/; 2, https://www.biorxiv.org/content/10.1101/2020.05.12.091462v1",5/18/2020,L.Y
33,23,1,Anti-SARS-CoV-2 Ab,S protein,Preclinical,"Coronavirus Immunotherapy Consortium; multiple partners, including Carterra",,,,USA,Summer 2020,"La Jolla Institute for Immunology (LJI) has been awarded a $1.73 million grant by the Bill & Melinda Gates Foundation to establish a Coronavirus Immunotherapy Consortium (CoVIC) as part of the foundation’s global efforts to stem the tide of the current coronavirus outbreak, the Institute announced yesterday. Antibody therapies are often the first novel therapies advanced for an emerging infectious disease. The effort is led by Erica Ollmann Saphire, Ph.D., a professor in LJI’s Center for Infectious Disease and Vaccine Research, who draws on her broad research experience guiding the development of antibody drugs and galvanizing a global research coalition that helped define which therapeutic antibodies effectively combat disease in humans infected with Ebola virus.
  Carterra published a video highlighting its being selected by Gates Foundation to fight COVID-19. https://carterra-bio.com/news/video-carterra-has-been-selected-by-the-gates-foundation-to-help-solve-the-covid-19-pandemic/
  April 20, 2020: The Saphire lab was awarded funds from Fast Grants for the purchase of CO2 shaker incubators that will allow culture of large quantities of cells for production of Spike and other SARS-CoV-2 proteins for the CoVIC.",https://www.prweb.com/releases/carterra_inc_selected_by_the_la_jolla_institute_of_immunology_to_provide_antibody_screening_and_characterization_for_the_coronavirus_immunotherapy_consortium_covic/prweb17016841.htm,5/18/2020,L.Y
34,24,1,Anti-SARS-CoV-2 Ab,S protein,Preclinical,"Chelsea and Westminster Hospital, Imperial College London",,,,UK,,"Researchers will develop antibodies that target the novel coronavirus with the aim of developing a new therapy for COVID-19. Antibodies are molecules produced by the body’s immune system that can specifically recognise and bind to structures, such as those on the surface of a virus, to block the virus entry and instruct the immune system to destroy it. They have already identified some antibodies that might bind to proteins from the COVID-19 coronavirus. In collaboration with China, the scientists will use these in this project to develop a potential antibody therapy, with the aim of getting the therapy to the stage where it is ready to enter clinical trials to determine if it can treat a range of coronavirus infections including the COVID-19 coronavirus. 
  March 23, 2020: Professor Xiaoning Xu, from the ICL's Department of Infectious Disease, will lead on a project to develop a therapy to treat COVID-19. Working with the University of Kent, Hong Kong University and the National Institute for Biological Standards and Control, the researchers will develop antibodies that target the virus with the aim of developing a new therapy for COVID-19. The team has already identified a panel of antibodies from people infected with the 2003 SARS coronavirus. These antibodies bind to highly pathogenic coronaviruses, including the COVID-19 coronavirus (SARS CoV-2). Funding is from UK Medical Research Council.",https://www.ukri.org/news/covid-19-vaccine-therapy-research-boosted-by-six-new-projects-in-rapid-response/,5/18/2020,L.Y
35,25,1,Anti-SARS-CoV-2 Ab,S protein,Preclinical,Columbia University/Brii Biosciences,,,,USA,,"March 11, 2020 – Brii Biosciences (“Brii Bio”) and Columbia University have entered into a memorandum of understanding through which Brii Bio will provide funding to support research to be conducted by investigators at the university and led by David Ho, M.D., founding scientific director of the Aaron Diamond AIDS Research Center and professor of medicine at the Vagelos College of Physicians and Surgeons. Brii Bio’s funding to Columbia comes in the form of an unrestricted grant to facilitate creating a framework for the formation of strategic collaborations in areas of complementary expertise and resources.
  The funding is expected to support work that focuses on finding solutions to the treatment, prevention and diagnosis of COVID-19 and other coronaviruses. Dr. Ho will serve as Principal Investigator. At the same time, Columbia and Brii Bio intend to work together to create a joint collaboration model to enable both parties to utilize their respective R&D, expertise and other in-kind contributions to advance the effort. 
  “As an international university with a global network of research collaborators, clinicians and patient-care capabilities, Columbia feels a special obligation to focus on public health threats such as coronaviruses, and our research teams are working now to identify potential antiviral drugs and antibodies against COVID-19,” said Dr. Ho. “Through this generous funding from Brii Bio, we look forward to building on our current research to create a truly holistic approach to diagnosis, treatment and prevention.”",https://www.briibio.com/news/44.html,5/18/2020,L.Y
