64,54,1,Anti-SARS-CoV-2 mAb,S protein,Preclinical,"ThermoGenesis Holdings, Inc., ImmuneCyte",mAb,,,,,"ThermoGenesis Holdings, Inc. 's joint venture partner, ImmuneCyte, has acquired from its collaborators worldwide intellectual property of four high-affinity monoclonal antibody drug candidates against COVID-19 virus. These high-affinity neutralizing monoclonal antibodies were obtained from the screening of enriched B cell libraries from individuals who have recently recovered from COVID-19 (i.e. from convalescent whole blood). The technologies were originally developed by a research team affiliated with East China Normal University, one of the most prestigious universities in China. The acquisition includes an undisclosed upfront cash payment and low double-digit future revenue sharing for the monoclonal antibody drug candidates under development. ThermoGenesis currently holds approximately 19% of the equity of ImmuneCyte. Derived from human B cells",https://www.biospace.com/article/releases/thermogenesis-announces-its-immunecyte-joint-venture-acquires-key-technologies-to-develop-fully-human-polyclonal-and-monoclonal-antibody-therapeutics-for-covid-19/,5/18/2020,X.X
65,55,1,Anti-SARS-CoV-2 mAb,S protein,Preclinical,GenScript ProBio,mAb,,,,,"As early as January 23 before the rapid outbreak, Discovery Department Head of GenScript ProBio, initiated the collaboration for an emergency screening project against 2019 nCoV together with Chongqing Academy of Animal Sciences and Chongqing CAMAB Biotech Ltd. The project team discussed the protocol details from antigen immunization to anti-2019 nCoV antibody characterization. For such emergency antibody drug project, the core lies in rapid antibody generation. This involves seamless integration of screening, sequencing and vector synthesis and further development to fight the 2019 nCoV outbreak. We finally worked out the optimal solution of rapid immunization coupled with GenScript ProBio Beacon single-cell platform screening and had multiple alternatives.
  In less than 24 hours, using the Beacon single-cell platform, GenScript ProBio completed immunized mice processing, immune cell isolation and enrichment, single cell sorting, on-chip binding and blocking screening, which usually takes three months using the traditional hybridoma antibody screening. 
  After successful antibody sequence screening, the team will work on expression of those antibody genes, and will perform further virus blocking and neutralization tests for the expressed antibodies. These Emergency antibodies after validation are expected to be put into mass production in GenScript ProBio to fight 2019 nCoV. Derived from transgenic mouse",https://finance.yahoo.com/news/genscript-probio-screens-anti-2019-144600434.html,5/18/2020,X.X
66,56,1,XAV-19,SARS-CoV-2,Preclinical,"Xenothera, LFB",,,,,,"Specializing in biotechnology, the Nantes start-up Xenothera is working on an antibody-based treatment. These so-called ""glyco-humanized"" antibodies are produced by animals, but resemble those of humans. At the head of the company, Odile Duvaux, claims to have already declined this technology in the treatment of cancer with a conclusive clinical trial around the rejection of transplants.
  
  On April 15, 2020, Xenothera announces its partnership with the LFB laboratory, which develops, manufactures and markets blood-derived drugs and therapeutic proteins for patients with serious and rare pathologies. 
  
  Code name: XAV-19
  XAV-19 is an intravenous therapy for patients with Covid-19. Administered to hospitalized patients, the goal of treatment is to prevent worsening and the transition to acute respiratory failure, which requires intensive care.
  
  Scientifically, polyclonal antibodies of animal origin are transformed, and are ""glyco-humanized"". This technique makes them similar to human antibodies by eliminating allergic risks and avoiding the risk of ADE (antibody-dependent increase) which, instead of treating the infection, worsens it quickly.
  
  More simply, this antibody-based treatment would boost the patient's immune defenses, prevent the virus from entering and multiplying in cells and reduce the inflammatory phenomenon.",https://franchementbien.fr/covid-19-a-nantes-une-biotech-developpe-le-xav-19-un-traitement-a-base-danticorps/,5/18/2020,X.X
67,57,1,,SARS-CoV-2,Preclinical,SAB Biotherapeutics,,,,,Summer 2020,"April 16, 2020: SAB is rapidly advancing the development of an antibody therapeutic to treat COVID-19. We’re on track to have a candidate ready as early as summer 2020. SAB’s cows are immunized every 28 days, and plasma can be collected from each animal three times a month for a monthly total of about 35-45 L DiversitAb platform was used to generate SAB-185, a transgenic cow-derived human polyclonal antibody therapy that is more consistent and easier to scale up than convalescent plasma from recovered COVID-19 patients.",https://sabbiotherapeutics.com/2020/04/24/behind-sabs-rapid-response-to-covid-19/,5/18/2020,X.X
68,58,1,Anti-SARS-CoV-2 mAb,S protein,Preclinical,Scripps/IAVI,mAb,,,USA,,"In under 7 weeks, we enrolled a cohort of SARS-CoV-2-recovered participants, developed neutralization assays to interrogate serum and monoclonal antibody responses, adapted our high throughput antibody isolation, production and characterization pipeline to rapidly screen over 1000 antigen-specific antibodies, and established an animal model to test protection. We report multiple highly potent neutralizing antibodies (nAbs) and show that passive transfer of a nAb provides protection against high-dose SARS-CoV-2 challenge in Syrian hamsters.",https://www.biorxiv.org/content/10.1101/2020.05.11.088674v2,5/18/2020,X.X
69,59,1,Anti-SARS-CoV-2 mAb,S protein,Preclinical,Adimab/UT Austin,mAb,,,USA,,"we mined the memory B cell repertoire of a convalescent SARS donor and identified 200 SARS-CoV-2 binding antibodies that target multiple conserved sites on the spike (S) protein. A large proportion of the antibodies display high levels of somatic hypermutation and cross-react with circulating HCoVs, suggesting recall of pre-existing memory B cells (MBCs) elicited by prior HCoV infections. Several antibodies potently cross-neutralize SARS-CoV, SARS-CoV-2, and the bat SARS-like virus WIV1 by blocking receptor attachment and inducing S1 shedding.",https://www.biorxiv.org/content/10.1101/2020.05.15.096511v1,5/18/2020,X.X
70,60,1,Anti-SARS-CoV-2 mAb,S protein,Preclinical,University of Amsterdam,mAb,,,the Netherlands,,,https://www.biorxiv.org/content/10.1101/2020.05.12.088716v1,5/18/2020,X.X
71,61,1,IgG1 ab1,S protein,Preclinical,University of Pittsburgh,mAb,,,USA,,,https://www.biorxiv.org/content/10.1101/2020.05.13.093088v1,5/18/2020,X.X
72,62,1,"CMAB020, STI-4920, ACE-MAB",SARS-CoV-2,Preclinical,Mabpharm/Sorrento Therapeutics,,,,,ASAP after regulatory approvals,"March 24, 2020. Sorrento Therapeutics, Inc. announced it has entered into an exclusive license agreement with China-based antibody biopharmaceutical company, Mabpharm Limited, for the clinical development and commercialization of the ACE-MAB fusion protein (Sorrento’s product code name STI-4920 and Mabpharm’s product code name CMAB020) for the potential treatment of COVID-19, the disease caused by the SARS-CoV-2 virus. Mabpharm has generated a fusion protein (CMAB020) that binds to the spike protein of the SARS-CoV-2 virus.
  
  March 31, 2020 Sorrento Therapeutics, Inc.announced it has entered into a research testing agreement with The University of Texas Medical Branch at Galveston for the preclinical testing of Sorrento's COVID-19 therapeutic product candidates. Sorrento is currently conducting preclinical development of multiple therapeutic candidates to treat COVID-19 across its proprietary platforms, including natural killer (NK) cell therapies, neutralizing antibodies (NAbs) and soluble recombinant fusion protein traps (COVIDTRAPTM) to potentially inhibit the binding of SARS-CoV-2’s spike protein with host ACE2 receptors, thereby potentially preventing viral cell entry. 
  ACE-MABTM is a proprietary bi-specific fusion protein that binds to the spike protein of coronaviruses, including SARS-CoV-2 and SARS-CoV, which is expected to block SARS-CoV-2 from binding and infecting respiratory epithelial cells or ACE2-expressing cells to interrupt the viral life cycle -- ACE-MAB is in the cGMP cell line development stage by our strategic partner, Mabpharm Limited, and could be ready for large-scale production in Mabpharm’s 30,000 m2 cGMP facilities in China for human clinical trials and commercialization upon receipt of requisite regulatory approvals -- Sorrento has been granted an exclusive license to develop and commercialize the ACE-MAB product candidate in the North American and European markets. Designed as a bi-specific fusion protein, ACE-MAB has two functional arms. One arm (Ab) is a fully human antibody that targets the spike protein of SARS-CoV-2 with high affinity. The other arm (TR) is a truncated ACE2 protein that binds to a different epitope of the spike protein. The ACE-MAB fusion protein could also block the receptor binding domain (RBD) with CD147 to mitigate lung inflammation and cytokine storm. The dual-arm design could be a unique advancement, potentially providing binding to the SARS-CoV-2 virus that is sufficient to prevent the virus from invading normal human cells. ACE-MAB retains the ACE2 enzymatic function, which could provide benefits such as reduced vasoconstriction and increased blood flow to infected lung tissue. The ACE2 arm competes with RBD binding to respiratory epithelial or other cells. It should preserve the ACE2 enzymatic activity, which is important in maintaining normal blood pressure and healthy blood flow into patients with infected lung tissue, which would include patients with advanced COVID-19 disease.","http://investors.sorrentotherapeutics.com/news-releases/news-release-details/sorrento-collaborates-mabpharm-development-and-commercialization
  http://investors.sorrentotherapeutics.com/news-releases/news-release-details/sorrento-launches-novel-i-celltm-covid-19-cellular-vaccine
  http://investors.sorrentotherapeutics.com/news-releases/news-release-details/sorrento-and-university-texas-medical-branch-galveston-enter
  http://investors.sorrentotherapeutics.com/news-releases/news-release-details/sorrento-provide-manufacturing-support-celularity-cynk-001-nk",5/18/2020,X.X
73,63,1,OstriGen SARS-CoV-2 mAbs,S protein,Preclinical,Ostrich Pharma USA (http://www.ostrigen.com/),,,,,,"MARCH 31, 2020: Ostrich Pharma USA has announced the successful development of ostrich antibodies to the SARS-CoV-2 virus, the expanding use of those antibodies in Japan, and plans for producing and deploying the antibodies in the U.S. Dr. Yasuhiro Tsukamoto, Dean of the Graduate School of Life and Environmental Sciences at Kyoto Prefectural University and Co-CEO of Ostrich Pharma USA, has injected a genetically engineered pseudovirus into ostriches, and antibodies were purified from their eggs. These antibodies demonstrate a strong ability to neutralize SARS-CoV-2 viruses. Dr. Tsukamoto said: ""We have produced ostrich antibodies to many viruses, bacteria, and allergens, but we were pleased to see how quickly the ostriches developed immunity and placed the anti-SARS-CoV-2 antibodies in their eggs. We were even more pleased to see how capable the antibodies were in blocking the virus that causes COVID-19.""
  Ten ostriches have been vaccinated, and the antibodies from their eggs have already been used in masks, nasal drops, and candies in Japan. Masks with antibody-impregnated liners have been proven to block 99.9% of influenza viruses. More than 70 medical institutions in Japan have purchased large numbers of ostrich antibody masks to prevent infections among healthcare workers, and the order rate is increasing. The Rinku Medical Clinic, a cancer hospital in Osaka, Japan, has begun a clinical trial on the use of ostrich antibody nasal drops to prevent hospital-acquired coronavirus infection. If a patient infected with SARS-CoV-2 is present, a doctor will spray the antibody solution into the nasal cavity of hospitalized patients, close contacts, and healthcare professionals. According to Dr. Takahiro Ishikawa, President of the Rinku Medical Clinic, ""In the absence of vaccines and therapeutics, proving that the ostrich antibody nasal drops have a preventive effect could be a real breakthrough.""
  Dr. Tsukamoto’s research also encompasses the study of the ostrich antibodies as a therapeutic. He and his research team have published results showing one hundred per cent efficacy of H5N1 (avian influenza) antibodies injected into chickens infected with the avian influenza virus. To reduce potential rejection after inoculation into humans, Dr. Tsukamoto is developing an antibody drug that uses various enzymes to cut ostrich antibody molecules into smaller molecules containing antigen-binding regions.
  According to Ostrich Pharma USA Co-CEO Stuart Greenberg, ""We recognize the enormous need for multiple approaches to the COVID-19 pandemic in the US. In order to be a participant in this war, we will need to immunize large numbers of ostriches, purify large amounts of the antibodies from the ostrich eggs, and get manufacturing capacity to make products, like masks. We will need to develop an approach to marketing, including defining the regulatory path, when appropriate. We expect to team with some key partners to accomplish this.""
  Ostrich Pharma USA, under the trade name “OstriGen,” is exploiting the powerful immune system of the ostrich to develop a revolutionary class of treatments and prophylaxes that are highly effective and economical.",https://finance.yahoo.com/news/ostrich-pharma-usa-produces-antibodies-203900885.html,5/18/2020,X.X
74,64,1,TriKE anti-SARS-CoV-2,S protein,Preclinical,"GT Biopharma, Inc.",,,,,,"Under the terms of the collaboration agreement, the companies will focus on preparing sufficient quantities of GT Biopharma's coronavirus TriKE drug product for preclinical evaluation using Cytovance's E. coli-based Keystone Expression System™ and subsequently, will scale-up production using Cytovance's GMP microbial manufacturing platform for evaluation of TriKE in humans to treat coronavirus infection. March 10, 2020 / GT Biopharma, Inc., a company focused on developing innovative therapeutic treatments based on its proprietary NK cell engager (tri-specific killer engagers, TriKE™) platform announced today that it had entered into a collaboration agreement with Cytovance® Biologics, a USA-based contract development and manufacturing organization (CDMO) and a subsidiary of the Shenzhen Hepalink Pharmaceutical Group Co., Ltd. to provide development services for a TriKE™ therapeutic for the treatment of coronavirus infection.",https://www.gtbiopharma.com/news-media/press-releases/detail/182/gt-biopharma-and-cytovance-biologics-announce-collaboration,5/18/2020,X.X
75,65,1,Convalescent plasma,SARS-CoV-2,Phase 3,Centre Hospitalier Sainte Anne,polyconal Ab,Human,,France,,,1. https://www.clinicaltrials.gov/ct2/show/NCT04350580?term=Centre+Hospitalier+St.+Anne+%28Paris%29&draw=3,5/18/2020,B.L
76,66,1,Convalescent plasma,SARS-CoV-2,Phase 2/3,Peking Union Medical College Hospital,polyconal Ab,Human,,China,,,1. https://www.clinicaltrials.gov/ct2/show/NCT04261426?term=gamma+globulin&cond=COVID-19&draw=2&rank=1,5/18/2020,B.L
77,67,1,Convalescent plasma,SARS-CoV-2,Phase 2/3,Erasmus Medical Center,polyconal Ab,Human,,Netherlands,,,1. https://www.clinicaltrials.gov/ct2/show/NCT04342182?term=convalescent+plasma&cond=COVID-19&draw=2,5/18/2020,B.L
78,68,1,Convalescent plasma,SARS-CoV-2,Phase 2/3,Universidad del Rosario,polyconal Ab,Human,,Colombia,,,1. https://www.clinicaltrials.gov/ct2/show/NCT04332835?term=convalescent+plasma&cond=COVID-19&draw=2,5/18/2020,B.L
79,69,1,Convalescent plasma,SARS-CoV-2,Phase 2,Puerta de Hierro University Hospital,polyconal Ab,Human,,Spain,,,1. https://www.clinicaltrials.gov/ct2/show/record/NCT04345523?term=convalescent+plasma&cond=COVID-19&draw=2,5/18/2020,B.L
80,70,1,Convalescent plasma,SARS-CoV-2,Phase 2,Assistance Publique – Hôpitaux de Paris,polyconal Ab,Human,,France,,,1. https://www.clinicaltrials.gov/ct2/show/NCT04345991?term=convalescent+plasma&cond=COVID-19&draw=2,5/18/2020,B.L
81,71,1,Convalescent plasma,SARS-CoV-2,,China-Japan Friendship Hospital,polyconal Ab,Human,,China,,,1.http://www.chictr.org.cn/showprojen.aspx?proj=50537,5/18/2020,B.L
82,72,1,Convalescent plasma,SARS-CoV-2,,Renmin Hospital of Wuhan University,polyconal Ab,Human,,China,,,1. http://www.chictr.org.cn/showprojen.aspx?proj=50696,5/18/2020,B.L
83,73,1,Convalescent plasma,SARS-CoV-2,,The First Affiliated Hospital of Nanchang University,polyconal Ab,Human,,China,,,1. http://www.chictr.org.cn/showprojen.aspx?proj=50059,5/18/2020,B.L
84,74,1,Convalescent plasma,SARS-CoV-2,,Wuhan Jinyintan Hospital,polyconal Ab,Human,,China,,,1. http://www.chictr.org.cn/showprojen.aspx?proj=49777,5/18/2020,B.L
85,75,1,"Anti-SARS-CoV-2 polyclonal hyperimmune globulin (H-IG), TAK-888",SARS-CoV-2,,CoVIg-19 Plasma Alliance amaong Biotest/ BPL/ CSL Behring/LFB/Octapharma/Takeda/ADMA Biologics/ BioPharma Plasma/ GC Pharma/ Sanquin.,polyconal Ab,Human,,USA,,,1. https://www.covig-19plasmaalliance.org/en-US#recruitment 2. https://www.takeda.com/newsroom/featured-topics/rajeev-venkayya-president-global-vaccine-business-unit-on-the-latest-on-the-coronavirus-and-takeda/,5/17/2020,B.L
86,76,1,Convalescent plasma,SARS-CoV-2,,China National Biotec Group Company Limited/ Wuhan Institute of Biological Products Co. Ltd,polyconal Ab,Human,,China,,,1. https://www.pnas.org/content/117/17/9490,5/18/2020,B.L
87,77,1,Recombinant anti-coronavirus 19 hyperimmune gammaglobulin,SARS-CoV-2,Preclinical,GigaGen,polyconal Ab,Human,,USA,,"GigaGen uses its leading single cell technology to capture and recreate complete libraries of antibodies from COVID-19 convalescent patients that can directly translate into antibody therapies. This method is much more scalable than plasma-based methods, since one person’s B cell repertoire can be used to generate a drug that treats millions of patients.",1. https://www.globenewswire.com/news-release/2020/03/30/2008438/0/en/GigaGen-Initiates-Development-of-Recombinant-Polyclonal-Antibody-Therapy-for-COVID-19.html 2. https://www.fiercebiotech.com/biotech/gigagen-jumps-into-covid-19-arena-polyclonal-antibodies,,
51,41,1,Anti-SARS-CoV-2 program,SARS-CoV-2,Preclinical,Xbiotech,polyconal Ab,Human,,USA,,"April 03, 2020 I XBiotech Inc. and BioBridge Global announced their collaboration to participate in a U.S. Food and Drug Administration (FDA) investigational program for U.S. blood centers to begin collecting and distributing convalescent plasma from individuals who have recovered from COVID-19. Plasma collected from these donors by the South Texas Blood & Tissue Center (STBTC), which also is a subsidiary of BioBridge Global, could be used to treat patients with serious and/or life-threatening COVID-19 infections. STBTC will, in return, provide blood samples to XBiotech to enable the development of a candidate True Human™ antibody therapy for the disease. XBiotech's True Human™ antibodies are the only available antibodies derived without modification from humans who possess natural immunity to certain diseases. (Unlike all commercially available antibodies, which are called “Humanized” or “Fully Human”, XBiotech’s True Human™ antibodies are directly sourced from the natural human immune response for specific diseases without modification, and thereby have not been shown to cause immunogenicity.)",http://investors.xbiotech.com/news-releases/news-release-details/xbiotech-and-biobridge-global-collaborate-fda-program-develop,5/18/2020,X.X
88,78,1,CD24Fc,CD24,Phase 3,OncoImmune,Fc fusion protein,,,USA,,,1. https://pipelinereview.com/index.php/2020042274389/Antibodies/OncoImmune-Starts-Phase-III-Clinical-Trial-Testing-the-Power-of-Dampening-Inflammation-to-Virus-induced-Cellular-Injury-in-Severe-COVID-19-Patients.html,5/17/2020,B.L
89,79,1,"STI-4398, COVIDTRAP",SARS-CoV-2,Preclinical,Sorrento Therapeutics,Fc fusion protein,,,USA,ASAP after regulatory approvals,"STI-4398 is in the cGMP cell line development stage and could be ready for large-scale production in Sorrento’s cGMP facilities in San Diego for human clinical trials and commercialization upon receipt of requisite regulatory approvals. STI-4398 is a proprietary ACE2 (angiotensin-converting enzyme 2)-Fc fusion protein (COVIDTRAP). The STI-4398 protein binds to the S1 domain of the spike protein, which is expected to block the spike protein of the SARS-CoV-2 virus to bind the ACE2 receptors present on the target respiratory epithelial cells. Without the ability to penetrate target cells, the SARS-CoV-2 virus cannot replicate and spread itself. By interfering with the viral infection cycle, STI-4398 might be the most effective way to prevent an infection to progress to a fully advanced COVID-19 disease.","https://www.biospace.com/article/releases/sorrento-develops-sti-4398-covidtrap-protein-for-potential-prevention-and-treatment-of-sars-cov-2-coronavirus-disease-covid-19-/
  https://www.biospace.com/article/biopharma-update-on-the-novel-coronavirus-april-23/?keywords=covid19
  https://www.biospace.com/article/releases/arch-biopartners-submits-application-to-health-canada-to-conduct-covid19-phase-ii-human-trial-for-metablok-to-prevent-lung-and-kidney-inflammation/?keywords=covid19
  https://www.biospace.com/article/using-ai-to-find-peptide-therapeutics-for-covid-19/?keywords=covid19",5/18/2020,X.X
90,80,1,IFX-1 (BDB-001),C5a,Phase 2/3,Staidson/InflaRx/Beijing Defengrei Biotechnology Co. Ltd.,mAb,,,China/Germany,,,1. https://clinicaltrials.gov/ct2/show/NCT04333420 2. https://www.inflarx.de/Home/Investors/Press-Releases/03-2020-InflaRx-Doses-First-Patient-in-Multicenter-Randomized-Clinical-Trial-in-Severe-Progressed-COVID-19-Pneumonia-in-Europe-upon-Receipt-of-Initial-Positive-Human-Data-with-InflaRx-s-anti-C5a-Technology.html,5/17/2020,B.L
91,81,1,Eculizumab,C5,Phase 2,"Alexion, Hudson Medical, Assistance Publique - Hôpitaux de Paris",mAb,Humanized Ab with mouse CDRs,mouse immunization,USA/France,,"NCT04346797 Phase 2 study sponsored by Assistance Publique - Hôpitaux de Paris. NCT04355494 study sponsored by Alexion. 
 For NCT04288713, An Emergency FDA IND must be submitted (FDA form 3926) for each patient. Subsequent to approval the primary investigator will obtain an authorization letter from Alexion Pharmaceuticals.",1. https://ir.alexion.com/news-releases/news-release-details/alexion-statement-solirisr-eculizumab-and-covid-19?_ga=2.147626548.2098111125.1589766151-90089888.1589766151; 2. https://clinicaltrials.gov/ct2/show/NCT04288713; 3. https://clinicaltrials.gov/ct2/show/NCT04346797; 4. https://clinicaltrials.gov/ct2/show/NCT04355494,5/17/2020,X.X
92,82,1,TJM2 (TJ003234),GM-CSF,Phase 1/2,I-MAB,mAb,,,USA/South Korea,,,1. http://www.i-mabbiopharma.com/en/article-517.aspx 2. http://www.i-mabbiopharma.com/en/article-491.aspx,5/17/2020,B.L
93,83,1,LY3127804,Ang-2,Phase 2 pending,Eli Lilly,mAb,,,USA,,"LY3127804 is an investigational selective monoclonal antibody against Angiopoietin 2 (Ang2). Lilly is advancing to Phase 2 testing in pneumonia patients hospitalized with COVID-19 who are at a higher risk of progressing to acute respiratory distress syndrome (ARDS). Ang2 is known to be elevated in ARDS patients and Lilly will test whether inhibiting the effects of Ang2 with a monoclonal antibody can reduce the progression to ARDS or the need for mechanical ventilation in COVID-19 patients. Angiopoietin2 (Ang-2) is a secreted glycoprotein that plays a complex role in angiogenesis and inflammation. 
 
 NCT04342897 is a Phase 2 Randomized, Double-blind, Placebo-controlled, Clinical Trial of LY3127804 in Patients Who Are Hospitalized With Pneumonia and Presumed or Confirmed COVID-19.",1. https://investor.lilly.com/news-releases/news-release-details/lilly-begins-clinical-testing-therapies-covid-19; 2. https://clinicaltrials.gov/ct2/show/NCT04342897,5/17/2020,X.X
94,84,1,SI-F019,ACE2,Preclinical,"Systimmune, Inc.",Fc fusion protein,,,USA,,"The SI-F019 protein incorporates the natural receptor for the virus that causes CoVID-19 disease, angiotensin-converting enzyme 2 (ACE2), as a means of neutralizing viral binding to cells lining the lungs and gastrointestinal tract, therefore blocking viral infection. Video showing MoA available at: https://www.youtube.com/watch?v=Y9aMxmZbM3I
 SI-F019 is specifically designed to mimic the naturally occurring human ACE2 protein target of CoVID19 and act as a neutralizing decoy. A bivalent architecture combined with the natural high affinity of CoVID-19 spike protein for this target is designed to synergistically out-compete viral adhesion to epithelial cells and reduce overall infection and disease severity. SI-F019 fusion technology comprises an Immunoglobulin Fc domain which provides both dimerization and half-life extension properties. Importantly, this domain has been engineered to eliminate immune activation which could lead to undesirable outcomes in some patients.",https://www.biospace.com/article/systimmune-inc-announces-si-f019-as-a-blocker-of-viral-entry-against-sarscov-2-with-reduced-inflammatory-risk-/,5/17/2020,X.X
