36,26,1,Anti-SARS-CoV-2 Ab,S protein,Preclinical,"IMMUNOPRECISE ANTIBODIES LTD/Talem Therapeutics, EVQLV",polyconal Ab,,Animal immunization; phage display,Canada,,"IPA’s multitargeting approach combines various SARS-CoV-2 spike protein forms with the Company’s diverse technologies. Hence, IPA anticipates that it can accelerate anti-SARS-CoV-2 human antibody discovery, targeting multiple viral epitopes and mechanisms of viral evasion, by immunizing Ligand’s (NASDAQ:LGND) OmniRat® animals using the Company’s Rapid Prime™ protocol followed by IPA’s B cell Select™ and hybridoma generation in parallel with human, naive phage library screening. Subsequent high-throughput binding assays, computational Artemis™ optimization, and protein interaction analyses permit faster preclinical lead selection.
  March 30, 2020: ImmunoPrecise announced that its partner EVQLV submitted its first panel of DNA sequences that may offer potential therapeutic antibodies against the new coronavirus, SARS CoV-2 or COVID-19. The DNA sequences were generated by EVQLV using computational antibody design, combining mathematics, statistics and computer science to pinpoint high-affinity antibodies. ImmunoPrecise said it will review the antibody candidates and select around 1,200 candidates to validate at its laboratory facilities. The firm will then screen and test the antibodies. 
  March 12, 2020: IMMUNOPRECISE ANTIBODIES LTD., following its announcement to develop innovative treatments against the new coronavirus, SARS-CoV-2, unveils its unique approach utilizing PolyTope mAb Therapy™, enabled by IPA’s diverse discovery platforms and artificial intelligence capabilities with their partner, EVQLV, Inc., in the development of a universal COVID-19 therapy.",https://www.immunoprecise.com/immunoprecise-announces-the-launch-of-polytope-mab-therapy-tm-to-tackle-coronavirus-pandemic/,5/18/2020,L.Y
37,27,1,Anti-SARS-CoV-2 Ab,S protein,Preclinical,"Israel Institute for Biological Research/Dyadic International, Inc.",,,,Isrea/USA,,"The Israel Institute for Biological Research has expanded its collaboration with Dyadic International, Inc. to explore the potential of C1 to express gene sequences and targets developed by IIBR into both an rVaccine candidate and monoclonal antibodies (""mAbs"") that may potentially help combat the COVID-19 outbreak. ""The Israel Institute for Biologcal Research was assigned by the Israeli Prime minister, Mr. Benjamin Netanyahu, to act as quickly as possible to produce a vaccine and neutralizing antibodies for the Novel Coronavirus COVID-19,"" said Prof. Shmuel C. Shapira, Director General of IIBR. Prof Shapira continued, ""More than 50 experienced Ph.D. IIBR's scientists are working tirelessly to produce a vaccine and neutralizing antibodies for the Novel Coronavirus COVID-19. This is a world-leading group in aspect of knowledge, experience and infrastructure. The Israel Institute for biological research was assigned to the task based on its proven professional scientific capabilities and previous successes in the field.""",https://irdirect.net/prviewer/release/id/4241329; https://irdirect.net/prviewer/release/id/4275577,5/18/2020,L.Y
38,28,1,Anti-SARS-CoV-2 mAb,S protein,Preclinical,YUMAB/Boehringer Ingelheim,mAb,,phage display,Germany,Summer/Fall 2020,Timeframe of Summer/Fall 2020 initiation of clinical study is from private communication (S. Duebel),https://www.yumab.com/partnership-with-boehringer-ingelheim/,5/18/2020,L.Y
39,29,1,Anti-SARS-CoV-2 mAb,S protein,Preclinical,Neurimmune AG / Ethris GmbH,mAb/mRNA,,,Switzerland,Q4 2020,"Neurimmune is identifying human anti-SARS-CoV-2 antibodies from the immune cells of recovered Covid-19 patients using its RTMTM Technology platform. Potent neutralizing antibodies will be translated into therapeutic SNIM®RNA products for inhalation. Based on current development plans, the first product candidate is expected to begin clinical testing in the fourth quarter of 2020, pending regulatory approval.",https://www.neurimmune.com/news/neurimmune-and-ethris-sign-collaboration-agreement-to-rapidly-develop-inhaled-mrna-based-antibody-therapy-for-the-treatment-of-covid-19,5/18/2020,L.Y
40,30,1,Anti-SARS-CoV-2 mAb,S protein,Preclinical,Celltrion,mAb,,,South Korea,7/1/2020,"Celltrion initiates the second stage; selecting the therapeutic antibodies which are most potent for neutralising the infection, after completing the first phase of screening 300 potential antibody candidates to treat COVID-19. 
  APRIL 13 2020, Celltrion announced that the company has successfully selected the most potent antibody candidates to neutralize SARS-CoV-2, the virus causing COVID-19. 
  Through a partnership with the Korea Centers for Disease Control and Prevention (KCDC), Celltrion initially identified and secured 300 different types of antibodies that bind to the SARS-CoV-2 antigen. These were then screened based on their ability to bind to the virus spike protein. Celltrion was then able to capture a total of 38 potent neutralizing antibodies, of which, 14 are powerful neutralizing antibodies against SARS-CoV-2. 
  Following the selection of antibody candidates which demonstrate high potency in neutralizing SARS-CoV-2, Celltrion will begin cell-line development. Once this is completed, Celltrion aims to roll out mass production of the therapeutic antibody and, together with the KCDC, Celltrion will conduct efficacy and toxicity testing in mice and non-human primates.",https://www.businesswire.com/news/home/20200322005024/en/Celltrion-Accelerates-Development-COVID-19-Antiviral-Treatment-Aims,5/18/2020,L.Y
42,32,1,Anti-SARS-CoV-2 mAb,S protein,Preclinical,FairJourney Biologics / Iontas,mAb,,phage display,Portugal,,"FairJourney Biologics (Porto, Portugal) and Iontas (Cambridge, UK) announced a partnership to expedite the identification of effective antibodies for a therapeutic to treat COVID-19 patients. The combination of FairJourney’s premier global technical expertise and extensive immune antibody libraries with Iontas’ next generation Mammalian Display technology will also see leading scientists from both companies join forces in the race to identify antibodies to be used in the development of safe and effective treatments.",https://www.iontas.co.uk/news-and-events/news/2020/apr/16/iontas-and-fairjourney-biologics-partner-covid-19-/,5/18/2020,L.Y
43,33,1,Anti-SARS-CoV-2 mAb,S protein,Preclinical,Beroni Group / Tianjin University,mAb,,nanobody,China,,"Beroni Group an international diversified biopharmaceutical enterprise focused on the research, development, innovation and commercialization of therapies and products for treatment of global diseases, is pleased to announce that it is collaborating with Tianjin University in China to develop a medical solution for the coronavirus (COVID-19) epidemic. 
  March 9, 2020: Beroni Group announced its development of a medical solution using nanobody technology for the novel coronavirus (COVID-19) in collaboration with Tianjin University in China has advanced into cytological experiments in March 2020.
  The research team has been able to obtain the information on the coronavirus nanobody sequence and the complex crystal structure of SARS-CoV-2, the virus causing the infection. The joint scientific teams have already studied the biochemical characterization of the modified nanobody. After evaluating the effect of the antibody modification, the teams are now moving into cytological experiments, which are expected to be completed this month. Shortly thereafter, we will conduct animal experiments followed by clinical trials, which are expected to occur in April 2020.",https://www.nsx.com.au/ftp/news/021737862.PDF,5/18/2020,L.Y
44,34,1,Anti-SARS-CoV-2 mAb,S protein,Preclinical,Harvard University,mAb,,nanobody,USA,,"Andrew Kruse and colleagues are spearheading a project to discover a way to neutralize and disable SARS-CoV-2. For years, the Kruse lab has focused on developing a method to mass-produce antibody fragments called nanobodies. They will use their library of synthetic camelid nanobodies and find ones that might be able to neutralize the virus.
  Kruse and Tim Springer are founders of the Institute for Protein Innovation, an open source hub that designs antibodies and other proteins as cures for intractable diseases.",https://kruse.hms.harvard.edu/research; https://hms.harvard.edu/news/through-storm,05/18/2020,L.Y
45,35,1,Anti-SARS-CoV-2 mAb,S protein,Preclinical,Rockefeller University,mAb,,nanobody,USA,,Parallel approaches are being taken to provide alternative means of prevention and therapy. Projects undertaken by Rockefeller Heads of Laboratory and their teams will address key needs in the field.,https://www.rockefeller.edu/coronavirus/research-program-covid-19-sars-cov-2/,05/18/2020,L.Y
46,36,1,Anti-SARS-CoV-2 mAb,S protein,Preclinical,"Alliance led by Proteona, including the University Clinic, Heidelberg, Tübingen University Hospital, the German Cancer Research Center (DKFZ), the NMI Natural and Medical Sciences Institute, NUS Enterprise, and 10x Genomics.",mAb,Human,single B cell,Germany/USA,,"Proteona Pte. Ltd. and partners have announced the launch of an international alliance to develop broadly neutralizing antibodies against coronaviruses including SARS-CoV-2, the virus causing the COVID-19 pandemic.","1, https://www.selectscience.net/industry-news/proteona-to-develop-sars-cov-2-neutralizing-antibody-against-covid-19/?artID=51028
  2, https://www.selectscience.net/industry-news/covid-19-155-drugs-and-79-vaccines-under-development-worldwide/?artid=51305
  3, https://www.selectscience.net/industry-news/redhill-biopharma-announces-agreement-with-niaid-to-evaluate-rhb-107-against-covid-19/?artid=51308",05/18/2020,L.Y
48,38,1,Anti-SARS-CoV-2 mAb,S protein,Preclinical,Distributed Bio,mAb,Human,,USA,,"Distributed Bio has identified thousands of anti-SARS-CoV-19 antibodies, and their scientists are currently working on engineering, selection, screening and production of candidates.",https://www.distributedbio.com/covid19,05/18/2020,L.Y
49,39,1,Anti-SARS-CoV-2 program,SARS-CoV-2,Preclinical,Amgen and Adaptive Biotechnologies,mAb,Human,single B cell cloning,USA,,Amgen and Adaptive Biotechnologies announced a collaboration aimed at helping address the COVID-19 pandemic. The companies will combine expertise to discover and develop fully human neutralizing antibodies targeting SARS-CoV-2 to potentially prevent or treat COVID-19. The mutually exclusive collaboration brings together Adaptive's proprietary immune medicine platform for the identification of virus-neutralizing antibodies with Amgen's expertise in immunology and novel antibody therapy development.,https://wwwext.amgen.com/media/news-releases/2020/04/amgen-and-adaptive-biotechnologies-announce-strategic-partnership-to-develop-a-therapeutic-to-prevent-or-treat-covid-19/,05/18/2020,L.Y
50,40,1,Anti-SARS-CoV-2 program,SARS-CoV-2,Preclinical,International group/Antibody Therapy Against Corona Virus,,,,Sweden/Belgium/Italy/Switzerland,,The international research association ATAC (Antibody Therapy Against Corona Virus) is developing antibody-based therapies against the lung disease COVID-19 caused by the SARS-CoV2 virus.,https://magazin.tu-braunschweig.de/pi-post/antikoerper-gegen-viren/,05/18/2020,L.Y
52,42,1,Anti-SARS-CoV-2 DARPin molecules,S protein,Preclinical,Molecular Partners,DARPin,,phage display,Switzerland,Q3 2020,"Research performed by Molecular Partners in collaboration with virologists at the Spiez Laboratory, a division of the Swiss Federal Office for Civil Protection, has characterized hundreds of monospecific and multispecific DARPin® proteins with strong binding and neutralizing qualities against multiple epitopes on the SARS-CoV-2 spike protein that are crucial for infection. The construction of multispecific candidates from monospecific proteins is the foundation of Molecular Partners’ drug discovery engine, and has yielded multiple clinical candidates in other indications.
  Molecular Partners is proceeding with expedited preclinical testing to select a lead candidate. The company has verified available manufacturing capacity and is targeting readiness of Good Manufacturing Practice-compliant drug product in Q3 2020. Trispecific; targets 3 parts of the spike protein of virus. Preliminary data indicate that multispecific DARPin® molecules show synergistic antiviral activity, exceeding the activity of their constituent parts. A multispecific DARPin® lead candidate will be chosen based on its capability to perform three distinct mechanisms of action (illustrative graphic): blocking binding of the human ACE2 receptor, the virus’s primary docking mechanism to host cells; blocking binding of a specific protease essential for spike protein activation; and “handcuffing” the spike protein, preventing the conformational change it undergoes prior to injection of viral RNA into the human cell. The final candidate is also expected to have its half-life enhanced with a DARPin® domain that binds to human serum albumin (HSA) to support long-acting activity.",https://www.molecularpartners.com/molecular-partners-initiates-anti-covid-19-therapeutic-program-leveraging-multi-target-binding-of-darpin-proteins-to-neutralize-sars-cov-2-virus/,05/18/2020,X.X
53,43,1,Anti-SARS-CoV-2 mAb by non-viral gene delivery platform,S protein,Preclinical,"Vir Biotechnology, Inc/ Generation Bio",mAb,,,,Summer 2020,"April 2,2020 Generation Bio and Vir Biotechnology to Collaborate on Research to Leverage Scalable Non-Viral Gene Therapy Platform for Durable Production of Monoclonal Antibodies Against Coronavirus.
  Generation Bio and Vir Biotechnology announced a collaborative research agreement to explore the potential for Generation Bio’s non-viral gene therapy platform to extend the impact and reach of Vir’s current or future human monoclonal antibodies (mAb) against SARS-CoV-2, the virus responsible for COVID-19. Generation Bio’s technology has the potential to deliver genetic information directly to cells without the use of adeno-associated viruses (AAV), in effect instructing the patient’s body to produce the antibody itself.
  Generation Bio's non-viral platform incorporates a proprietary high-capacity DNA construct called closed-ended DNA, or ceDNA; a novel cell-targeted lipid nanoparticle delivery system, or ctLNP; and an established, scalable capsid-free manufacturing process. The company is designing therapies to provide targeted delivery of genetic payloads that include large and multiple genes across a broad array of tissues, and to be redosable for individualized and extended treatment throughout a patient’s life.",https://investors.vir.bio/news-releases/news-release-details/generation-bio-and-vir-biotechnology-collaborate-research,5/18/2020,X.X
54,44,1,Anti-SARS-CoV-2 mAb,S protein,Preclinical,Medicago/Laval University,,,,Canada,,"Medicago is using its technology platform to develop antibodies against SARS-CoV-2 in collaboration with the Laval University’s Infectious Disease Research Centre headed by Dr. Gary Kobinger, who helped develop a vaccine and treatment for Ebola. These SARS-CoV-2 antibodies could potentially be used to treat people infected by the virus. This research is being funded, in part, by the Canadian Institutes for Health Research (CIHR).",https://www.businesswire.com/news/home/20200312005345/en/Medicago-Announces-Production-Viable-Vaccine-Candidate-COVID-19,5/18/2020,X.X
55,45,1,Anti-SARS-CoV-2 VNAR antibodies,S protein,Preclinical,Ossianix,VNAR antibodies,,,UK,,"The screening campaign against the COVID-19 spike protein at Ossianix is advancing rapidly and we hope to announce the results to the scientific community over the coming weeks.
  
  Ossianix wishes to partner after this screening stage with interested parties in government, academia or biotech and pharma companies to develop the virus blocking VNAR antibodies and move the project to a therapeutic reality in the shortest possible time. A novel approach being pioneered at Ossianix uses its patented VNAR phage display libraries to identify single domain antibodies with high affinity and specificity against the COVID-19 spike protein. The spike protein is the site of attachment of the virus with its cellular receptor ACE-2 and blockade at that site will neutralize its activity.
  
  Single domain VNAR antibodies have large CDR3 binding domains that preferentially bind cavities and buried epitopes in proteins. These are often the sites of protein-protein interactions. It is thus highly likely that screening of the multi-isoform and[HKC1] highly complex VNAR libraries will identify hits that will be different from those isolated from human B cells. Once identified, VNAR single domain antibodies can then be developed to block these sites. Certain VNAR antibodies that bind to the transferrin receptor have also shown the capability to specifically target the lung in rodents and non-human primates. These VNARs can be fused to antibodies or other therapeutics creating bispecific biologics for targeted delivery.",https://www.ossianix.co.uk/,5/18/2020,X.X
56,46,1,Anti-SARS-CoV-2 mAb,S protein,Preclinical,AvantGen,mAb,,yeast display,USA,,"April 21, 2020: AvantGen, Inc. announced it has identified and tested fully human synthetic antibodies (“mAbs”) against Severe Acute Respiratory Syndrome Coronavirus 2 (SARS-CoV-2, the “novel Coronavirus”) that show promise for development as diagnostics for SARS-CoV-2 infection and therapeutics for Coronavirus Disease 2019 (COVID-19). Screened yeast display human synthetic libraries against the virus for therapeutic and diagnostic development. Within 3-4 weeks, we were able to isolate hundreds of unique mAbs directed against the spike envelope protein of the SARS-CoV-2 virus and identified a subset that are able to block the spike protein binding to the receptor on human cells, Angiotensin Converting Enzyme -2 (ACE2)”.
  Testing conducted by the Company in close collaboration with leading academic groups demonstrate that a panel of unique mAbs can effectively neutralize virus-induced cell-killing, also known as cytopathic effect (CPE). Among these neutralizing unique mAbs, some can block the spike protein from interacting with ACE2, while others do not block the interaction. The finding that two distinct groups of unique mAbs, with different binding sites on the spike protein can neutralize the virus paves a way for the development of a cocktail of mAbs comprising blocking and non-blocking neutralizing mAbs for potentially a more effective therapy.",https://www.avantgen.com/news/aventgen-develops-novel-antibodies-to-covid-19/,5/18/2020,X.X
57,47,1,Anti-SARS-CoV-2 mAb,S protein,Preclinical,Innovent Biologics,mAb,Human,,China,,"April 3, 2020: Innovent Biologics is currently doing studies and research on antibodies taken from people who have successfully recovered from the COVID-19 respiratory disease. Even if it can successfully identify the antibodies, Innovent Biologics disclaimed that it will likely take about a year to develop the drug and prepare it for its first human clinical trials.",https://www.btimesonline.com/articles/129691/20200403/chinese-drug-maker-innovent-biologics-developing-antibody-treatment-for-covid-19.htm,5/18/2020,X.X
58,48,1,Anti-SARS-CoV-2 mAb,S protein,Preclinical,"Ablexis, LLC, AlivaMab Discovery Services, LLC and Berkeley Lights, Inc",mAb,,,USA,,"April 22, 2020: Ablexis, LLC, AlivaMab Discovery Services, LLC and Berkeley Lights, Inc. announced the rapid generation and recovery of sequences encoding a rich panel of human antibodies against the S1 spike protein of the SARS-CoV-2 virus. Based on multiplex screening assays performed on the Beacon® platform, these SARS-CoV-2 S1 antibodies may be binned into subsets based on their binding to the receptor binding domain (S1B) of SARS-CoV2, blocking of S1B binding to the ACE2 receptor, and cross-reactivity with the S1 spike protein of the SARS-CoV virus. The observed diversity includes activities consistent with different mechanisms of action hypothesized for highly efficacious antibody therapy and prophylaxis of infection by SARS-CoV-2. The companies will jointly make these antibodies available to an organization with the capabilities and commitment for their further research and development.",https://www.prnewswire.com/news-releases/ablexis-alivamab-discovery-services-and-berkeley-lights-collaborate-to-identify-a-diverse-panel-of-anti-sars-cov-2-human-antibodies-301045039.html,5/18/2020,X.X
59,49,1,Anti-SARS-CoV-2 mAb,S protein,Preclinical,Ligand,mAb,,,USA,,"April 6, 2020: Ligand’s partners are actively progressing two OmniAb antibody discovery programs for the potential treatment of COVID-19. One multinational big pharma partner has initiated a program using OmniChicken® and another partner is focused on antibodies derived from OmniRat®. Names of partners were not divulged.",https://www.businesswire.com/news/home/20200406005284/en/Ligand-Corporate-Update-Announces-6th-Date-Quarter,5/18/2020,X.X
60,50,1,Anti-SARS-CoV-2 mAb,S protein,Preclinical,Institut Pasteur,mAb,,,France,,2019-NCOV THERAMAB project aim: to elucidate the mechanisms behind the antibody responses to SARS-CoV-2 and investigate the role they may play in eliminating the virus in infected individuals. The idea is to improve our understanding of the antibody responses of anti-SARS-CoV-2 memory B lymphocytes at molecular and functional level (B lymphocytes are the immune cells that produce antibodies). The memory B cells that develop after an initial infection have a long life span and are capable of intervening rapidly and effectively in the event of reinfection. The project aims to harness the discoveries made to develop a treatment based on the use of human neutralizing antibodies (immunotherapy).,https://www.pasteur.fr/en/press-area/coronavirus-mobilisation/coronavirus-covid-19-research-projects#p17,5/18/2020,X.X
61,51,1,Anti-SARS-CoV-2 mAb,S protein,Preclinical,"Fusion Antibodies, Queen's Univeristy",mAb,,,,,"April 29, 2020: Northern Ireland biotech firm is to raise £3m to help it expand its work to include Covid-19 treatment. Fusion Antibodies announced it's now part of an antibody development alliance, set up to help in the global fight against the coronavirus pandemic. The company specialises in pre-clinical antibody discovery, engineering and supply.
  
  The company announced earlier this month that it would be working with Queen's University as part of the Coronavirus Antibody Development Alliance. It's now working with Professor Ultan Power, of the Wellcome-Wolfson Institute of Experimental Medicine; Professor Chris Scott, in The Patrick G Johnston Centre for Cancer Research; and Dr Fuquan Lui, in the School of Biological Sciences, to prepare antibodies that will potentially neutralise the virus.",https://www.belfasttelegraph.co.uk/business/northern-ireland/belfast-biotech-firm-to-raise-3m-to-help-research-antibodies-in-fight-against-coronavirus-39165921.html,5/18/2020,X.X
62,52,1,Anti-SARS-CoV-2 mAb,S protein,Preclinical,BioDuro LLC,mAb,,,,,"March 26, 2020 — BioDuro LLC, a leading global life sciences contract research and development organization announced today that it has initiated a COVID-19 nanobody therapeutic program, leveraging the company’s biologics discovery platform and a specialized COVID-19 dedicated team. The cornerstone of the effort includes screening more than 10 billion human synthetic antibodies generated using Artificial Intelligence (AI) computing and high-speed DNA mutagenesis technology.
  
  BioDuro’s COVID-19 program relies on synthetic antibody technology, targeting both ACE2 receptor on the human cell and spike protein on the virus. The goal is to block the viral entry and fusion into the cell. To do so, BioDuro’s COVID-19 team built a high diversity phage displayed synthetic antibody library, which comprises ~10 billion human antibodies. Each antibody in the library is made different using high speed DNA mutagenesis, a process which BioDuro scientists optimized using advanced AI computing.
  
  The next step for the BioDuro team will be to screen each of the billions of antibodies—a process that will take a few months—to determine which antibody disrupts the virus most optimally. The final product aims to be a nanobody, which is an antibody, but contains only a single, very small unit needed for recognition and disruption of the COVID-19 targets.",https://bioduro.com/article/bioduro-announces-covid19-nanobody/,5/18/2020,X.X
63,53,1,Anti-SARS-CoV-2 mAb,S protein,Preclinical,Hemogenyx Pharmaceuticals plc,mAb,,,,,"Hemogenyx Pharmaceuticals plc (LSE: HEMO), the biopharmaceutical group developing new therapies and treatments for deadly blood diseases, is deploying its groundbreaking research and technologies to develop treatments for COVID-19.
  
  Using its humanized mice, the Advanced peripheral blood Hematopoietic Chimera (“ApbHC”), which were developed to model blood and autoimmune diseases and to test treatments, Hemogenyx will seek to discover human neutralizing antibodies – antibodies that are typically developed by the human immune system to neutralize invading viral pathogens – that could be used to fight SARS-CoV-2 (the virus that causes COVID-19) infections.
  
  Prior to the appearance of COVID-19, Hemogenyx had been working independently and with a number of pharmaceutical company partners to utilize the exceptional features of ApbHC to identify and isolate human neutralizing antibodies for use as antiviral therapies.",https://hemogenyx.com/investors/investors/announcements/announcement/2020/covid-19-project-initiated/,5/18/2020,X.X
